{
  "schema_version": "sandbox_catalog_v1",
  "catalog": {
    "key": "macOS_codex_v1",
    "title": "macOS seatbelt with Codex CLI (example catalog)",
    "description": "Capabilities observed when running probes against macOS seatbelt and the Codex CLI runner (example catalog).",
    "labels": [
      "macos",
      "seatbelt",
      "codex"
    ],
    "notes": "Example catalog for macOS Seatbelt and the Codex CLI. Replace with another catalog to target different environments or clients."
  },
  "scope": {
    "description": "Observed macOS sandbox and agent runtime behaviors as exercised by this harness.",
    "notes": "Probes focus on observable sandbox behaviors; this catalog is not a complete Seatbelt reference and will evolve over time.\n",
    "policy_layers": {
      "os_sandbox": "18 capabilities for Seatbelt / macOS sandbox behavior as seen by child processes.",
      "agent_runtime": "4 capabilities for Codex agent orchestration and approvals policy around sandboxed runs."
    },
    "categories": {
      "filesystem": "6 capabilities for access to workspace trees, system roots, user content, and symlink behavior.",
      "process": "3 capabilities for process creation, execution, and sandbox escalation behavior.",
      "network": "3 capabilities for outbound connectivity, localhost-only patterns, and network disablement.",
      "sysctl": "2 capabilities for access to OS configuration and hardware information via sysctl.",
      "ipc": "1 capability for inter-process communication via Mach and related primitives.",
      "sandbox_profile": "3 capabilities for profile structure, logging, and parameterization features.",
      "agent_sandbox_policy": "4 capabilities for session-level approvals, trust lists, sandbox env markers, and default sandboxing behavior."
    },
    "limitations": "Only macOS sandbox capabilities are modeled. Capabilities are defined at a level suitable for probe design, not formal closure. Document produced via human-machine collaboration--errors are mine; responsibility is yours.\n"
  },
  "docs": {
    "apple_sandbox_guide": {
      "title": "Apple Sandbox Guide v1.0",
      "url": "https://reverse.put.as/wp-content/uploads/2011/09/Apple-Sandbox-Guide-v1.0.pdf"
    },
    "deep_dive_agent_sandboxes": {
      "title": "A Deep Dive on Agent Sandboxes",
      "url": "https://pierce.dev/notes/a-deep-dive-on-agent-sandboxes"
    },
    "chromium_sandbox_v2": {
      "title": "Mac Chromium Sandbox V2 Design Doc",
      "url": "https://chromium.googlesource.com/chromium/src/+/HEAD/sandbox/mac/seatbelt_sandbox_design.md"
    },
    "run_code_sandbox": {
      "title": "Run Code in a macOS Sandbox",
      "url": "https://mybyways.com/blog/run-code-in-a-macos-sandbox"
    }
  },
  "capabilities": [
    {
      "id": "cap_fs_read_workspace_tree",
      "category": "filesystem",
      "layer": "os_sandbox",
      "description": "Ability for commands to read files anywhere under the Codex workspace root(s).",
      "operations": {
        "allow": [
          "file-read*",
          "file-read-data",
          "file-read-metadata"
        ],
        "deny": []
      },
      "meta_ops": [],
      "agent_controls": [],
      "notes": "This is the \u201cnormal\u201d mode for Auto / Full access in Codex \u2013 agents must be able to read the checked-out project tree, but not arbitrary user directories. Expect to be implemented as allow file-read* (subpath WRITABLE_ROOT_i) for each workspace root, with deny default.\n",
      "sources": [
        {
          "doc": "apple_sandbox_guide",
          "section": "2, 5.2 \u2013 File operations and allow/deny model"
        },
        {
          "doc": "chromium_sandbox_v2",
          "section": "SBPL example using (subpath (param \"USER_HOME_DIR\"))"
        },
        {
          "doc": "run_code_sandbox",
          "section": "Profile that allows read/write to $PWD only"
        },
        {
          "doc": "deep_dive_agent_sandboxes",
          "section": "Codex Auto mode workspace access and SandboxPolicy.writable_roots"
        }
      ],
      "labels": [
        "macos"
      ]
    },
    {
      "id": "cap_fs_write_workspace_tree",
      "category": "filesystem",
      "layer": "os_sandbox",
      "description": "Ability for commands to create/modify/delete files inside the workspace roots.",
      "operations": {
        "allow": [
          "file-write*",
          "file-write-data"
        ],
        "deny": []
      },
      "meta_ops": [],
      "agent_controls": [],
      "notes": "Codex enumerates a set of writable roots from SandboxPolicy and passes them as WRITABLE_ROOT_i parameters into the Seatbelt profile; writes are allowed only under these roots, with everything else denied by default. Probes should verify both creation and deletion semantics inside a known workspace subdirectory.\n",
      "sources": [
        {
          "doc": "apple_sandbox_guide",
          "section": "5.2 \u2013 file-write* family"
        },
        {
          "doc": "run_code_sandbox",
          "section": "Deny-by-default Python sandbox with explicit file-read* and file-write* rules"
        },
        {
          "doc": "deep_dive_agent_sandboxes",
          "section": "Seatbelt WRITABLE_ROOT_i construction and writable_folder_policies"
        }
      ],
      "labels": [
        "macos"
      ]
    },
    {
      "id": "cap_fs_read_git_metadata",
      "category": "filesystem",
      "layer": "os_sandbox",
      "description": "Read-only access to .git directories under each workspace root.",
      "operations": {
        "allow": [
          "file-read*",
          "file-read-data",
          "file-read-metadata"
        ],
        "deny": [
          "file-write*"
        ]
      },
      "meta_ops": [],
      "agent_controls": [],
      "notes": "Codex treats .git as a read-only subpath under each writable root: attempts to write within .git should be denied while neighboring paths in the workspace remain writable. Probes can exercise this by creating or modifying files inside .git and comparing the result with writes to adjacent non-.git paths under the same root.\n",
      "sources": [
        {
          "doc": "deep_dive_agent_sandboxes",
          "section": "Seatbelt profile generation \u2014 WRITABLE_ROOT_i and read_only_subpaths",
          "url_hint": "deep-dive-agent-sandboxes#seatbelt-profile-generation"
        },
        {
          "doc": "apple_sandbox_guide",
          "section": "File operations and path/subpath filters",
          "url_hint": "Apple-Sandbox-Guide-v1.0.pdf#file-operations"
        }
      ],
      "labels": [
        "macos"
      ]
    },
    {
      "id": "cap_fs_read_system_roots",
      "category": "filesystem",
      "layer": "os_sandbox",
      "description": "Read-only access to core system directories needed for toolchains and runtimes.",
      "operations": {
        "allow": [
          "file-read*",
          "file-read-data",
          "file-read-metadata"
        ],
        "deny": []
      },
      "meta_ops": [],
      "agent_controls": [],
      "notes": "Typical profiles allow read-only traversal of /, /System, /Library, /private, /dev, /usr, and sometimes ~/Library, while keeping user content folders more restricted. This is required for compilers, interpreters, and language runtimes to function inside the sandbox.\n",
      "sources": [
        {
          "doc": "run_code_sandbox",
          "section": "Profile allowing file-read-data on root, /System, /Library, /private, /dev, /usr, ~/Library"
        },
        {
          "doc": "apple_sandbox_guide",
          "section": "5.2 \u2013 file-read* semantics and examples"
        }
      ],
      "labels": [
        "macos"
      ]
    },
    {
      "id": "cap_fs_read_user_content",
      "category": "filesystem",
      "layer": "os_sandbox",
      "description": "Ability to read user content folders (Documents, Desktop, etc.) from within the sandbox.",
      "operations": {
        "allow": [
          "file-read*",
          "file-read-data",
          "file-read-metadata"
        ],
        "deny": []
      },
      "meta_ops": [],
      "agent_controls": [],
      "notes": "Some sandbox setups intentionally deny file-read-data for specific user directories while allowing system paths and workspace roots. Probes should check for read access to common user content paths such as ~/Documents or ~/Desktop, which are sensitive from a data-exfiltration perspective.\n",
      "sources": [
        {
          "doc": "run_code_sandbox",
          "section": "Allow-by-default profile that explicitly denies network* and selected user folders"
        },
        {
          "doc": "apple_sandbox_guide",
          "section": "5.3.1 \u2013 path filters and subpath semantics for file-read*"
        }
      ],
      "labels": [
        "macos"
      ]
    },
    {
      "id": "cap_fs_follow_symlinks_out_of_workspace",
      "category": "filesystem",
      "layer": "os_sandbox",
      "description": "Whether a process can escape workspace constraints via symlinks pointing outside writable roots.",
      "operations": {
        "allow": [
          "file-read*",
          "file-write*"
        ],
        "deny": []
      },
      "meta_ops": [],
      "agent_controls": [],
      "notes": "Seatbelt resolves symlinks before applying path filters, so a profile written against canonical /private/tmp instead of /tmp can avoid obvious bypasses. A probe can create a symlink in the workspace pointing to a sensitive directory (e.g. home dotfiles) and then attempt reads/writes through the symlink to see if the sandbox enforces canonical paths.\n",
      "sources": [
        {
          "doc": "apple_sandbox_guide",
          "section": "5.3.1 \u2013 note on symlink resolution for path filters"
        },
        {
          "doc": "deep_dive_agent_sandboxes",
          "section": "Discussion of writable_roots canonicalization on macOS"
        }
      ],